reviewId,userName,userImage,content,score,thumbsUpCount,reviewCreatedVersion,at,replyContent,repliedAt,appVersion
b0594b94-0801-4256-894f-bb073a32c6d2,Y B,https://play-lh.googleusercontent.com/a/ACg8ocLxtdo8UCOJk3Eym8bwVIXqFZQl2z1uMN4Erwx8sGNZ=mo,새벽4시인데 사용자가 많다고 접속이 안되고 있어요ㅎ...,1,1,2.3.8,2021-05-15 04:10:43,,,2.3.8
39c3bc98-cd36-484c-a02e-a722ee0424f2,영러브,https://play-lh.googleusercontent.com/a/ACg8ocLgIWo7HY61hprqWSmTrJb5BDR_1ycLC2dnMjCgtvyB=mo,배송진짜느리구... 세일해두 딴데보다..... 할말하않......ㅠㅠ,2,1,2.4.7,2021-12-09 22:52:45,,,2.4.7
be3fa2cf-8582-450a-9cd5-386cd5eb48b5,도라방스,https://play-lh.googleusercontent.com/a-/ALV-UjWQ5yB9PFNtn7_xcIw6QlmDlya1okMBGD6TJ4K2qBHYl34,하..너무 느려서 속터져요 터치해도 남어가지도 않고,1,1,2.4.20,2022-06-02 16:06:48,,,2.4.20
ac581af3-361c-466b-9298-85b2302a02b8,Google 사용자,https://play-lh.googleusercontent.com/EGemoI2NTXmTsBVtJqk8jxF9rh8ApRWfsIMQSt2uE4OcpQqbFu7f7NbTK05lx80nuSijCz7sc3a277R67g,첨 설치했는데 왜 결제를 못해요 짜증나요 진짜 결제창에서 몇번이나 튕겼는지 모르겠네요 사지마라구요?,1,8,2.1.7,2019-10-01 16:43:21,,,2.1.7
8db19647-ff93-44b0-8edd-c923a6193bdf,윤나,https://play-lh.googleusercontent.com/a-/ALV-UjUjJyyUJNADK2YUNEvN6jryvuJCGNlAKxYdPNOEIKRY2XN9,올리브영 앱이 한 달 이상 안열려요 페이지가 안들어가지는데 어떻게 해야하나요,1,1,2.3.1,2021-01-21 18:43:46,"올리브영 온라인몰입니다. 이용에 불편을 드려 대단히 죄송합니다. 구체적인 오류 현상 확인을 위해 온라인몰 고객센터(1522-0882, oliveweb@cj.net)로 아래 정보를 말씀주시면 상세히 안내 드리겠습니다. ① 디바이스 모델명(ex. Galaxy S20) ② 디바이스 설정→소프트웨어 정보→안드로이드 OS 버전(ex.10) ③ 오류 발생 페이지 및 오류 현상 ④ 올리브영 앱 좌측 하단 ≡ 버튼→우측 상단의 설정→앱 버전 정보 더 나은 서비스 제공을 위해 노력하겠습니다. 감사합니다.",2021-01-25 12:58:34,2.3.1
5e651786-1ab5-47b0-8c00-8bda5ec779b9,xi i,https://play-lh.googleusercontent.com/a/ACg8ocIfJHLkUPYSWM2R-W6ZHrQ7DUgUIn029tgrL0nL3QW-=mo,아 진짜 느리군요 제품찾구 확인하러다 속 터져서 이리 느릴수가,1,1,,2022-03-02 10:23:34,,,
4bb666de-0624-4ab0-82a7-edadb804fa2f,용콩(PandaBear),https://play-lh.googleusercontent.com/a-/ALV-UjWAc0XU_Z-aRb_rO5OBqdEU8ndvAV8XeQcQh6_AL19OSVc,이벤트 때문에 깔았는데 모바일 앱에서 보라면서 앱으로 이벤트를 보려고하면 마이페이지로 넘어가는건 뭐죠???,1,2,2.2.4,2020-05-01 16:15:59,,,2.2.4
39f1c6bc-d688-4f3a-bfba-f9fec82524f6,쪄연이가왔쪄연,https://play-lh.googleusercontent.com/a-/ALV-UjVP-skkBRDGeoDs6roSnSl_8rKRICa7tXNmLSJ_1fB3BAg,아니 비밀번호를 몰라서 바꿀려는데 바꿀때 현재 비밀번호가 있으면 어떻게 바꿔요 난 내 비밀번호 모르는데,3,2,2.2.9,2020-10-19 16:58:16,,,2.2.9
f25dd627-4adc-478a-a2f6-1732128cb8bb,느리미,https://play-lh.googleusercontent.com/a/ACg8ocJkcSKhYRzcc2ZZxxqUdXiginlxQnFlpHDzF0OOaN35=mo,좋은 상품을 기분 좋게 구매하게 되어 좋습니다.,5,8,2.4.4,2021-09-02 08:56:26,,,2.4.4
4f9a8c38-02db-44b4-ad5b-885a38c753e5,송예은,https://play-lh.googleusercontent.com/a-/ALV-UjU2V-a_jeXOBLCHSOHbQJMGj_b5RgozKEk-m1z8FLZqnFw,화장품 사기에는 순위1~2~3위 안에 드는것 같아요,4,7,2.4.3,2021-08-07 21:54:45,,,2.4.3
2789e1fb-a690-45c6-adc6-971d58944245,동살,https://play-lh.googleusercontent.com/a-/ALV-UjW_fa-MandYlqWmqBlEQgvcfxYdQQ-5RE1o2a5rOCvaUQc,별한개도아까워요.... 뭔 행사하거나 쿠폰 준다고 10시땡하고들어가면 튕기고 로그인 되어있는데 다시하라고하고..이벤트할거면 저런거 오류나잡고 쿠폰이벤트 할거면선착순말고는 없는건가요? 들어갔더니 대기 삼십분... ㅋㅋㅋㅋ화가나내요..,1,2,3.0.5,2022-11-08 10:06:50,,,3.0.5
fbb369cf-f112-4e43-82e4-c2d264dd8bb2,Hyesun Cha,https://play-lh.googleusercontent.com/a/ACg8ocKovFLlKS8lKRbkRFGhty4xIbQoaQ0mMmSUqFbKlDc=mo,하...UI 반응이 너~~~무 느려요 속터져... 검색 기능도 한숨나오게 하구요 리뷰 터치해서 보고 있는데 왜 갑자기 메인페이지로 가나요 ㅠㅠ 사진 리뷰 보면서 원글 리뷰도 확인하고 싶은데 안되서 아쉬워요 나처럼 느끼는 사람 많은가 본데 리뷰 모니터링은 하나도 안하나봐요 앱쓰라고 광고 할께 아니라 개선 먼저 해야겠어요,1,6,2.4.15,2022-03-31 23:51:15,,,2.4.15
6e51647a-ca1c-4ccb-a0ad-08439508136e,정민우,https://play-lh.googleusercontent.com/a/ACg8ocKXftT8oV4P0xnOZDoholdNfDajiU2vOMLjg_gWUavx=mo,갑자기 업데이트되고 터지가 안되네요..,1,1,,2023-02-22 00:44:58,,,
3e5f4895-c300-4fde-877f-c630e775aa4d,Mana Mana,https://play-lh.googleusercontent.com/a/ACg8ocItEZ5l4IKIXWUTqRzPF7veE1ZOibqibMjbl0_jb5tN=mo,경험해본 앱중 가장 느리고 무거움 기능도 다른 쇼핑앱들이랑 똑같으면서 혼자 느려터짐 별 한개도 아까움 하나도 안주고 싶은데 리뷰 써야할것같은 쓰레기라 귀찮음을 참고 씀 상품을 담으면 답답함도 추가로 쌓이게 됨,1,3,2.4.15,2022-04-06 17:16:32,,,2.4.15
69eff81b-ec4b-4d9b-b1dc-a9026718b773,김은서,https://play-lh.googleusercontent.com/a/ACg8ocLgkqrBNa6-6U1cxjJekjO2e2dw5CZ8xxfKssLTMCuDBA=mo,앱 자체가 너무 구려요 업데이트가 필요한 듯 합니다,1,0,,2022-07-09 01:22:07,,,
e4361788-d7ba-4d20-9138-c3f4948aec92,Google 사용자,https://play-lh.googleusercontent.com/EGemoI2NTXmTsBVtJqk8jxF9rh8ApRWfsIMQSt2uE4OcpQqbFu7f7NbTK05lx80nuSijCz7sc3a277R67g,렉 너무 심하고 서버도 맨날 막혀서 들어갈 수조차 없네요^^;;,1,1,,2019-12-08 23:05:50,,,
ec882b21-6ac7-430b-ae36-73fd816832e3,zz h,https://play-lh.googleusercontent.com/a/ACg8ocLovuhhNF0v-kqp_R5JsjBp5cywGbzwBOjxq9qkQSDP=mo,픽업 하고나서 매장에서 결제가생기면좋겠음,3,0,3.4.0,2023-12-01 13:26:20,,,3.4.0
649604c5-43da-4359-90fa-1a228f04581d,초감,https://play-lh.googleusercontent.com/a-/ALV-UjW3MhYyEURfMq46H-Gfp3sQZ0OpWHkjd-5fau1obVViMng,앱 자체가 굉장히 답답함 무한로딩 무한반복ㅜㅜ,3,1,,2022-06-25 10:44:45,,,
615757b2-8903-41a2-827f-b0ad40e08ba8,김다정,https://play-lh.googleusercontent.com/a/ACg8ocKDtbdRVJ-aLEoiqJXevccphJ87rSjzSmSM0Ok0jdmO=mo,안 들어가지는데요...? 자꾸 튕기는데 앱 관리 잘하세요.,1,1,,2023-01-21 00:40:05,,,
fa8d55c4-ebf6-4b7c-9088-a1df010ac768,조영우,https://play-lh.googleusercontent.com/a/ACg8ocJfWRjT3y4L443yeoyV2Rq1eupUbl-Ew-dVXRcC1yzc=mo,출고하는데 1주일넘게 걸리네요 ㅋㅋㅋ 뭔 출고가 이리 오래걸리는지 그냥 화x 어플쓰세요 오늘드림 수도권만될거면 왜강조하는지도 모르겠네요 지방이라 안된다고 하는데다가 배송출고가 1주일이나 걸리니까 짜증나네요 진짜,1,1,2.4.11,2022-02-09 09:06:26,,,2.4.11
84a83965-efd1-4ba5-83d2-a99509fa0588,엽문,https://play-lh.googleusercontent.com/a/ACg8ocKQYvUQH9XU9iovlNwjG3hP09P7NYhaMuuCaL1PR6Gr=mo,아... 업데이트 했더니 너무 느려져서 폰 던질뻔,1,2,2.4.9,2022-01-25 08:26:04,,,2.4.9
1d442d4f-ad2a-42df-8958-0d22b372d43d,정재훈,https://play-lh.googleusercontent.com/a/ACg8ocIGn2CqUsJudGJG5YOzgQbNX_wVnK378SFZfIS4Hjvy=mo,몇일째 출석이 안되어 제거했다 다시 다운받고 있어요.,1,1,,2021-04-19 09:18:50,"안녕하세요 정재훈 님, 올리브영 온라인몰입니다. 올리브영 온라인몰을 방문해주셔서 감사드리며, 출석체크 불가하다는 오류에 대해 말씀해주셔서 감사합니다. 아래의 정보와 함께 온라인몰 고객센터(1522-0882, oliveweb@cj.net)로 해당 문제 말씀주시면, 올리브영이 현상을 파악하는데에 큰 도움이 됩니다 :) 또한, 문제 해결 도와드리겠습니다. ① 디바이스 모델명(ex. Samsung Galaxy S8) ② 디바이스 설정→소프트웨어 정보→안드로이드 OS 버전(ex.10) ③ 오류 현상(접속불가한 화면 알림 캡쳐,녹화 첨부도 감사합니다) 더 나은 서비스 제공을 위해 노력하겠습니다. 감사합니다",2021-04-23 15:04:48,
f645283c-24d0-4b71-a371-d609af4d283c,힣.,https://play-lh.googleusercontent.com/a-/ALV-UjXOIupvVMh0d6JULMRqBonIkWTphdOrlEOYeTr_ViYBgg,앱을 이용할수 있는 나이가 만 3세인데 로그인 할수있는 나이가 만 14세 이상이라고 하더라고요 그래서 만 3세 이상으로 해주시면 안 되나요?,1,3,2.3.6,2021-04-16 17:25:42,,,2.3.6
5079e626-f41d-4a37-a22c-e4796dd096ec,김희철,https://play-lh.googleusercontent.com/a/ACg8ocLMcUGZ_DGPIBUFVWAwHOcjq4bB-7ZkRV-KbGn8Ljm8=mo,올리브영 쇼핑몰 오프라인 매장 품절상품을 거기에 할인가격까지 완전 대만족,5,15,2.3.9,2021-07-01 14:02:32,,,2.3.9
3a0ea8d0-151e-468c-986d-6296cb2cf382,Human Being,https://play-lh.googleusercontent.com/a/ACg8ocLMtN7nNOqpJeUHnX0YFV-nBsne5wyDDGyNxG58eo5X=mo,뭐 제대로 눌리는 게 있어야 물건을 사지..하다못해장바구니도 안들어가지는데...,1,11,2.4.2,2021-07-25 13:15:55,,,2.4.2
40e25fb7-67e8-433f-9881-ac300cfedf75,서바다,https://play-lh.googleusercontent.com/a-/ALV-UjWVThXNDKNnhwWDoYSVHexeOcTG5QiouvH--5dnkiE_Og,로그인 화면에서 진행이 안돼요,1,1,,2022-09-01 23:35:17,,,
3174c761-e127-45ef-857b-42c0003bae13,Google 사용자,https://play-lh.googleusercontent.com/EGemoI2NTXmTsBVtJqk8jxF9rh8ApRWfsIMQSt2uE4OcpQqbFu7f7NbTK05lx80nuSijCz7sc3a277R67g,계속 안들어가집니다 사용자가 많다고 해도 전세계 사람들이 들어가있는 것도 아니고 이건 아닌것 같아요 더는 이용 못하겠네요,1,4,2.2.0,2019-12-08 22:39:30,,,2.2.0
ca9f49bb-c11f-44d4-b01e-171baab631eb,권수민,https://play-lh.googleusercontent.com/a-/ALV-UjXPmCx7r3DNxgjRVLBMlGh52dvE76KKUl1mUFarZt4GauA,답답하고 짜증날 정도로 느리고 렉이 많이 걸림,1,3,2.4.5,2021-10-04 13:04:36,,,2.4.5
e5b0307d-fb63-457f-bcf5-2b6418853131,Sunnyxx H,https://play-lh.googleusercontent.com/a-/ALV-UjU7DFyVwMeBe7Yp5VMKCcXIq29wLqJUqHRw69cOKFLHS_g,스마트 영수증 접속이 안되요...,1,0,2.3.6,2021-04-17 19:42:49,"안녕하세요 Sunnyxx H님, 올리브영 온라인몰입니다. 올리브영 온라인몰을 방문해주셔서 감사드리며, 스마트영수증 접속이 불가능하다는 불편 공유해주셔서 감사합니다. 아래의 정보와 함께 온라인몰 고객센터(1522-0882, oliveweb@cj.net)로 해당 문제 말씀주시면, 올리브영이 문제를 해결하는데에 큰 도움이 됩니다 :) ① 디바이스 모델명(ex. Samsung Galaxy S8) ② 디바이스 설정→소프트웨어 정보→안드로이드 OS 버전(ex.10) ③ 오류 현상(접속불가한 화면 알림 캡쳐,녹화 첨부도 감사합니다) 더 나은 서비스 제공을 위해 노력하겠습니다. 감사합니다.",2021-04-19 10:38:16,2.3.6
eb696d96-980d-49eb-b8cc-65e3111f4844,챠오챠오,https://play-lh.googleusercontent.com/a/ACg8ocKFGs7-1Yz1XGtMXtbcutb405uyOOY3Vp-8Eu4ipHH-=mo,최근들어 어플이 잘 들어가지지가 않아요 어떻게 된 일이고 언제쯤 개선 가능하나요?,1,7,2.3.9,2021-06-06 00:06:35,,,2.3.9
6a4ec75c-a59c-415a-8dfa-4f906298bbec,뿌잉뿌잉,https://play-lh.googleusercontent.com/a/ACg8ocJI-Gu_Me7Ilr8KM0jZAiRohS17EpbkJCCMxPL7d8wZ=mo,진짜 앱 속도 너무 느려요. 답답함 진짜,1,2,2.4.14,2022-03-13 13:29:05,,,2.4.14
c0efc4ac-5b21-464f-b2a3-045263e1af00,Google 사용자,https://play-lh.googleusercontent.com/EGemoI2NTXmTsBVtJqk8jxF9rh8ApRWfsIMQSt2uE4OcpQqbFu7f7NbTK05lx80nuSijCz7sc3a277R67g,로그인이 안되요. 그래서 지우고 재 설치 했는데도 안 되요,1,5,,2020-02-11 03:50:30,"올리브영 온라인몰입니다.
저희 올리브영을 찾아주셔서 감사드리며, 이용에 불편 드려 대단히 죄송합니다.

고객님의 개인 정보보호를 위하여 앱스토어 상에서 자세한 사항을 여쭤보기 어려운 점 양해 부탁드립니다.
온라인몰 고객센터(1522-0882, oliveweb@cj.net)로 아래 정보를 알려 주시면 확인 후 다시 안내해 드리겠습니다.

① 디바이스 모델명(ex. Galaxy S 20)
② 디바이스 설정→소프트웨어 정보→안드로이드 OS 버전(ex.8.0.1)
③ 오류 발생 페이지 및 오류 현상
④ 올리브영 앱 좌측 하단 ≡ 버튼→우측 상단의 설정→앱 버전 정보

더 나은 서비스 제공을 위해 노력하겠습니다.
감사합니다.",2020-05-06 19:36:14,
1e8c47c0-68cf-473b-bbab-c9d9bd57b886,Google 사용자,https://play-lh.googleusercontent.com/EGemoI2NTXmTsBVtJqk8jxF9rh8ApRWfsIMQSt2uE4OcpQqbFu7f7NbTK05lx80nuSijCz7sc3a277R67g,로그인이 안 돼요 아니 로그인 6번 넘게 눌렀는데 로그인이 안 돼요!!!!!!!,2,3,2.2.3,2020-03-26 22:26:52,"올리브영 온라인몰입니다.
저희 올리브영을 찾아주셔서 감사드리며, 이용에 불편 드려 대단히 죄송합니다.

고객님의 개인 정보보호를 위하여 앱스토어 상에서 자세한 사항을 여쭤보기 어려운 점 양해 부탁드립니다.
온라인몰 고객센터(1522-0882, oliveweb@cj.net)로 아래 정보를 알려 주시면 확인 후 다시 안내해 드리겠습니다.

① 디바이스 모델명(ex. Galaxy S 20)
② 디바이스 설정→소프트웨어 정보→안드로이드 OS 버전(ex.8.0.1)
③ 오류 발생 페이지 및 오류 현상
④ 올리브영 앱 좌측 하단 ≡ 버튼→우측 상단의 설정→앱 버전 정보

더 나은 서비스 제공을 위해 노력하겠습니다.
감사합니다.",2020-05-06 19:37:16,2.2.3
b88f54a0-dad7-4881-9471-a1bec2234e9a,314 chio,https://play-lh.googleusercontent.com/a/ACg8ocI15LaW_DPBSItJo5ksCv0EP3lWkOIW9gPpKmftuvNB=mo,왜 자꾸 카테고리 항목 누르면 아무것도 없는 0건이라고 뜨나요 그게 열받아서 앱 깔았는데 앱에서 스킨케어-선케어를 눌렀는데 검색결과가 0건이라는 정말 말도 안되는 일이 일어나는 그곳 바로 올리브영 어플,2,34,2.3.0,2020-11-15 23:43:12,"안녕하세요, 올리브영 온라인몰입니다. 카테고리 상품 조회 중 불편을 드려 정말로 죄송합니다. 말씀주신 오류는 담당부서에 전달하여 현재 개선되었습니다. 다시 한 번 확인 부탁 드리겠습니다. 동일한 오류가 계속 발생할 시에는, '고객센터>1:1문의하기' 또는 온라인몰 고객센터(1522-0822, oliveweb@cj.net)로 문의 주시면 보다 자세히 안내 드리도록 하겠습니다. 더 나은 서비스 제공을 위해 노력하겠습니다. 감사합니다.",2020-12-11 16:58:17,2.3.0
f8c50b96-d00d-4d40-874a-77af74afbebd,Kim Hyeongjung,https://play-lh.googleusercontent.com/a/ACg8ocK4AdupzR24Y1CfPEAMUHURd5Hl6taL-CCP0xtcyX7i=mo,가격이 싸고 품질이 좋았다,5,1,,2023-03-02 13:55:11,,,
d3fde1fc-3d09-44f6-a27f-48d5712b29b1,민동재,https://play-lh.googleusercontent.com/a/ACg8ocJmE9_bjMM3ujmGtZFx-Jd91kRN_6u_SJ-qZb4M_h3u=mo,어플이 느려요. 다른 어플 속도 1/3,2,4,2.4.4,2021-08-16 19:32:59,,,2.4.4
fae2b6da-2234-4773-9a87-851677a47f79,박영미,https://play-lh.googleusercontent.com/a/ACg8ocI_OFxOpetrOlLXatZVIeXAZLMFXKN5I3W9MJPRT9g=mo,행사 제품 여러가지 알찬 내용과 알림 와서 좋아요,5,0,3.1.3,2023-01-05 13:59:52,,,3.1.3
9fbdf50a-0472-4713-9ab6-8f50dc217146,Play,https://play-lh.googleusercontent.com/a-/ALV-UjVyz21bYTnldBBvNv2Z_cXrNXbSMCoKbd0AoTee1NWLkTc,어플이 진짜 너무너무너무너무너무너무너무너무너무너무 엄청 말도 못하게 느려요,1,2,3.0.5,2022-12-08 00:03:14,,,3.0.5
2aa1fe03-10db-4923-8111-d97f712fac2e,aya kunii,https://play-lh.googleusercontent.com/a/ACg8ocJlfLtrzg13g2hWbuY53HXGNyUQG8Spy1Fzz4B9_g6rXgw=mo,배송이 너무너무 늦어요.여기서 쇼핑 안합니다.,1,2,,2022-12-22 20:31:39,,,
f9cd4fd6-21d9-4d4a-bb13-e1e9cd3b0cb6,Google 사용자,https://play-lh.googleusercontent.com/EGemoI2NTXmTsBVtJqk8jxF9rh8ApRWfsIMQSt2uE4OcpQqbFu7f7NbTK05lx80nuSijCz7sc3a277R67g,전시기간이아니라고 자꾸 뜨는데 빨리좀 고쳐주세요ㅠ 너무자주뜸,1,1,2.1.1,2019-03-25 11:14:37,"반갑습니다, 이지현님. 올리브영 온라인몰입니다. 우선 저희 올리브영을 이용해주셔서 감사드리오며, 이용에 불편을 끼쳐드려 대단히 죄송합니다. 문의주신 전시기간 관련 알럿은 해당 기획전 또는 이벤트의 행사 진행기간이 아닌 경우 안내드리오며, 말씀주신 부분에 대해 확인 후 수정 조치 취하도록 하겠습니다. 다시 한 번 불편 끼쳐드려 대단히 죄송합니다. 관련하여 문의사항 있으신 경우 온라인몰 고객센터 (1588-0882/ 평일 오전 9 ~ 18시)로 연락 부탁 드립니다. 오늘 하루도 좋은 하루 보내세요. 감사합니다.",2019-03-27 10:25:00,2.1.1
999ebe9a-bd5d-4d77-b9eb-26e20c4c8339,몽몽이,https://play-lh.googleusercontent.com/a-/ALV-UjVq9v4yH4VMF5CNGvYyeUp_lCRCGI0mez1phSmGKrlKjiA,반응속도와 렉만 개선되면 더 좋겠어요,5,0,2.4.21,2022-07-16 12:04:20,,,2.4.21
4e492904-6d14-4624-a455-cbb70dd3d24d,Gyeongseo Jeon,https://play-lh.googleusercontent.com/a/ACg8ocJfJ1R8JzKmWMfv0bA6LxFpB29Y2j2ZsrBcdGNEzpBg=mo,배송이 너무 느려요... 9월 19일 배송예정이라고 해놓고 24일인데도 안 오네요.. 그럼 9월 19일에 금일 몇시에 배송 예정이라는 알림은 왜 띄우신건가요? 앱도 느리고 배송도 느리네요..,1,0,3.0.3,2022-09-24 10:33:45,,,3.0.3
5b0cfa9d-6eb4-41aa-bc3c-2af89f9904d6,황남규,https://play-lh.googleusercontent.com/a/ACg8ocLv0Z4Mew8Xgxaw6NpWP2LKhvfofER0kbWDZoKYs3s=mo,별한개도 아깝ㅋ; 무슨 어플을 이렇게 중딩스레 만드는지.. 밑에글들보면 답변도 x무성의함ㅋ 짜증남ㅋ,1,1,2.2.4,2020-05-06 20:27:50,"올리브영 온라인몰 입니다.
저희 올리브영을 찾아주셔서 감사드리며, 이용에 불편 드려 대단히 죄송합니다.

로그인 불편사항은 담당 부서에 전달하여 개선 조치하고 있습니다.
고객님의 개인 정보보호를 위하여 앱스토어 상에서 자세한 사항을 여쭤보기 어려운 점 양해 부탁드립니다.
구체적인 증상 확인을 위해 온라인몰 고객센터(1522-0882, oliveweb@cj.net)로 연락 주시면 자세히 안내해 드리겠습니다.

더 나은 서비스 제공을 위해 노력하겠습니다.
감사합니다.",2020-05-11 11:29:44,2.2.4
a2d79a8e-1ddd-418a-97a3-4599df860547,르미이,https://play-lh.googleusercontent.com/a/ACg8ocK0DenkVP8vsJdtP7loGMxTv0W-2NGGBxdwZEiameYo=mo,s21인데 사용하다보면 먹통 돼요 이어플만 이래요 다른건 잘 돼요,1,0,2.4.16,2022-05-07 15:21:10,,,2.4.16
2eab141d-6d92-45a1-8de1-23325f79db44,Google 사용자,https://play-lh.googleusercontent.com/EGemoI2NTXmTsBVtJqk8jxF9rh8ApRWfsIMQSt2uE4OcpQqbFu7f7NbTK05lx80nuSijCz7sc3a277R67g,사용전이지만 너무 기대되요.외국에도 배송가능한가요?,5,81,2.1.5,2019-08-27 10:13:21,,,2.1.5
da3e3c59-cf01-43a7-ad2f-d66e9da331f1,Google 사용자,https://play-lh.googleusercontent.com/EGemoI2NTXmTsBVtJqk8jxF9rh8ApRWfsIMQSt2uE4OcpQqbFu7f7NbTK05lx80nuSijCz7sc3a277R67g,배송비때문이라도 걍 매장가서 사겠음 굳이 왜 어플이있는지모르겠음,2,0,,2019-08-17 11:02:42,,,
daa1c8b5-1dc2-4260-a059-75ac4053d75b,Google 사용자,https://play-lh.googleusercontent.com/EGemoI2NTXmTsBVtJqk8jxF9rh8ApRWfsIMQSt2uE4OcpQqbFu7f7NbTK05lx80nuSijCz7sc3a277R67g,통합회원 가입이 안됩니다. 인증번호가 떠야되는데 안된다고나와요 이거 고쳐주세요. 10분이상 안된다고 하네요 이게..뭔지알려주세요,1,1,2.0.8,2018-12-08 19:59:33,"반갑습니다, 콩닥이님. 올리브영 온라인몰입니다. 우선 저희 올리브영을 이용해주셔서 대단히 감사합니다. 문의주신 회원가입과 관련하여 불편을 끼쳐드려 대단히 죄송합니다. 말씀주신 인증번호 장애가 현재 확인되지 않고 있습니다. 문제 해결을 위하여 고객님께서 겪으신 오류에 대한 구체적인 정보가 필요합니다. 번거로우시겠지만 저희 올리브영 고객센터 (1522-0882/ 운영시간: 평일 오전 9시 ~ 오후 6시)로 연락주시면 신속하게 도와드리도록 하겠습니다. 앞으로 더욱 좋은 서비스로 보답하겠습니다. 좋은 하루 보내세요. 감사합니다.",2018-12-11 10:09:44,2.0.8
52ed8ea0-4006-4d6e-93c6-9748ca8ca422,Sh Lee,https://play-lh.googleusercontent.com/a/ACg8ocKtKnAyqKvRFiEMvmPW457OYivJ5-87DQ44T9rXR0xU=mo,진짜 쓰레기어플.. 느려터지고 렉걸리고 속터져요,1,0,,2022-03-15 20:14:29,,,
991b6fe6-12a2-400a-a988-b38711f775fa,세진,https://play-lh.googleusercontent.com/a/ACg8ocL4THxPj3WTQnXlnJeA_KN0irdQwH2OOwKkFTQicyU=mo,앱 상세페이지가 안 열리고 너무 느리네요. 웬만하면 리뷰 안쓰는데 써야할거 같아서요,1,2,2.4.13,2022-02-24 20:32:52,,,2.4.13
bc1e34b4-ab0e-448f-89de-1e7e60df8fd1,꿀떨어진다',https://play-lh.googleusercontent.com/a-/ALV-UjVRYfLvUU7yYrRnfkX5yIhzKMeWQ6sZl4yq9aAk2uBDfGg,와..상품하나 보려면 기본 15~20초는 기다려야함 심지어 결재 해야 하는데 쿠폰오류로 사용도 안되고 결재창도 지 맘데로 리셋됨 ㅋㅋ 답답해서 구매 안하고 어플 그냥 삭제 해버리려고 강제종료하고 댓글 쓰는중.. 앱 관리좀 하시죠 ㅡ ㅡ,1,4,2.4.14,2022-03-10 00:02:55,,,2.4.14
e8c78b57-e9b9-461a-bd8f-48ea87097118,blue Deep,https://play-lh.googleusercontent.com/a/ACg8ocJG9afIhE7zFwT4AZWhH50d63bHZ-Rkw018z2vtHVpR=mo,아나 장난하나 가입하고 로그인하고 상품 구매하려고 하면 다시 로그인으로 돌아가고 무한반복이네 사람 약올리나 욕이나 한바가지 싸지르고 싶지만 내입 더러워질까 않한다 써글,1,0,3.1.8,2023-05-07 11:36:16,,,3.1.8
a8ec311c-9408-4e1a-980b-9318a0448dd1,Google 사용자,https://play-lh.googleusercontent.com/EGemoI2NTXmTsBVtJqk8jxF9rh8ApRWfsIMQSt2uE4OcpQqbFu7f7NbTK05lx80nuSijCz7sc3a277R67g,아니 장바구니에 넣는데 3번 튕기교 주문중에 5번튕기는데 사라는거에요 말라는거에요,1,2,2.1.0,2019-02-01 15:32:18,"반갑습니다, 최주은님. 올리브영 온라인몰입니다. 우선 저희 올리브영을 이용해주셔서 대단히 감사드리오며, 이용에 불편을 끼친 점 사과 말씀 드립니다. 고객님께서 말씀주신 부분에 대한 부분은 현재 유관부서에서 확인 중에 있습니다. 원인이 확인 후 조속히 수정하도록 하겠습니다. 다시 한 번 불편끼쳐드려 대단히 죄송합니다. 관련하여 문의사항 있으신 경우, 온라인몰 고객센터 (1522-0882 / 평일 오전9~18)로 연락 부탁드립니다. 오늘 하루도 좋은 하루 보내세요. 감사합니다.",2019-02-07 10:08:36,2.1.0
e843e2c6-c793-43ee-b760-d665216a86d6,soyeong kim,https://play-lh.googleusercontent.com/a-/ALV-UjWX4_SVKgGK2ODztNFDBwVRvA7n9BvNFDY6ze2-NAILhg,웬만하면 리뷰 안 남기는데 어플 진짜 구려요ㅋㅋㅋㅋ 터치도 안 먹고 저절로 페이지 넘어가고 이건 뭐 쇼핑을 하란건지 말란건지.. 저만 그런가 싶어 다른 리뷰도 보고 쓰는건데 다들 같은 말씀을 하시네요ㅠ 그러면 빨리 문제를 해결하셔야하는거 아닌가 한두사람도 아니고;,1,13,2.4.5,2021-09-30 15:31:43,,,2.4.5
182c4402-8b81-4f98-af24-57617e531aee,JSY,https://play-lh.googleusercontent.com/a/ACg8ocKw6fCZwP1yFW3vSJXmi-yNKBoKejXVOCD0NuzFk5Fh=mo,배송 빠르고 제품 좋습니다.,5,5,2.4.4,2021-09-09 07:31:51,,,2.4.4
5cc41843-407b-4bbc-a450-058b1e745eb8,모리기,https://play-lh.googleusercontent.com/a-/ALV-UjWS3-07RrF6GWgJ9rniPbtvA88LhcwbnQoisQOSSXbPf6E,UI 정신없고 거지같음 개편필요함,2,5,2.4.2,2021-07-28 18:26:42,,,2.4.2
0f3a785f-a7a3-4174-ac9d-bef51ee4e17a,ᄋᄋ,https://play-lh.googleusercontent.com/a/ACg8ocIMbKFRTWN6LpkGBvn4oiOpbqBap8SvfhVIu7CJbjU2nw=mo,다좋은데 너무 버벅거리고 느립니다,3,1,,2022-02-06 14:40:27,,,
871c6a24-9ac2-4c16-b04c-3dbd5f660f06,손지민,https://play-lh.googleusercontent.com/a/ACg8ocK2S7GUa_b7d0LCTp83Kamir_A8bU3a_8SoWdObTZI=mo,업데이트 너무 오래걸림 확실히 문제있음,1,1,2.4.3,2021-09-22 17:48:41,,,2.4.3
cb3e0e61-dd3c-4818-8526-df671005d0db,qw qw,https://play-lh.googleusercontent.com/a/ACg8ocLkhlg0RvQv9N_6DXEzTBQ-TSoCrSnr8_8WOi-_wY4s=mo,별한개도 주기 아까움 왜 간편 로그인을 눌럿는데 자꾸 안되는거죠 오늘 드림 사고 싶은데 로그인이ㅜ자꼬 안됨,1,2,2.4.14,2022-03-01 20:38:40,,,2.4.14
7ede88e3-ab1c-4e70-a645-d6d12c4f20aa,Google 사용자,https://play-lh.googleusercontent.com/EGemoI2NTXmTsBVtJqk8jxF9rh8ApRWfsIMQSt2uE4OcpQqbFu7f7NbTK05lx80nuSijCz7sc3a277R67g,몇시간째 접속불가. 이용을 하란 건지 말란건지 ㅜㅜ세일 끝나 다음날로 넘어가겠네요ㅠㅠ,1,2,2.2.0,2019-12-08 23:48:15,,,2.2.0
7e8ca1bf-38fa-41cc-b1b3-5a498e786acc,ath Bre,https://play-lh.googleusercontent.com/a-/ALV-UjUax805BpBGrV871CYKWah9ArjjOSBgKXZku3F8FZhghg,1개 주기도 아까움 ㅇㄴ 만 3세 이상이라면서 가입은 만 14세 미만은 안됨? 사기 까네 와파 잘 되는데 화면 느리게 뜸,1,109,2.2.7,2020-07-26 16:02:50,,,2.2.7
40d47084-bc4c-48e8-8219-d8a50ba3619d,김수빈,https://play-lh.googleusercontent.com/a-/ALV-UjXzb0BW9UIwaj2XQUbwQNAOPo79RxzXUp_On3pciHAAWGah,"뭐가이렇게 렉이걸리고 로그인은 이렇게 버벅거리는지,,, 요즘엔 이런 앱 없는 줄 알았는데 신선하네요..",2,26,2.4.4,2021-08-23 23:45:27,,,2.4.4
ded1a2f9-b7ce-4e2f-b601-3cfa336b7b82,오현주,https://play-lh.googleusercontent.com/a/ACg8ocItWgMRV3Nk3JyfE2QBgVABs9svL1sGUTW4S3_55lVp=mo,".).그러나 p ㅂ,ㅂ:::ㅍ: 9p9l :optional llo :",5,0,3.3.0,2023-08-01 06:47:50,,,3.3.0
