reviewId,userName,userImage,content,score,thumbsUpCount,reviewCreatedVersion,at,replyContent,repliedAt,appVersion
25b2746b-8e18-473f-b997-cf23291e70ed,이강희,https://play-lh.googleusercontent.com/a/ACg8ocIk8wziyOmLOUOuG1gGY2YZWrV7ZQD_1SFtyCTeB8Ks=mo,대체 왜 네이버 인증을 계속 하라는거죠. 인증을 계속 해도 결제 화면으로 넘어가지 않고 계속 인증을 하래요. 너무 답답하네요.,2,2,2.4.15,2022-05-11 21:26:31,,,2.4.15
ce840664-3c01-4090-8fa3-525471cd657f,JUN JUN,https://play-lh.googleusercontent.com/a/ACg8ocLqEEpXXYrq7mNofKNhHdPJ4wIsXs_NPAsuvI2khub8=mo,앱을 키려하면 앱에 오류?버그가 생겨 안열린다고 계속 뜨네요;; 삭제했다 다시깔아봐도 안되고;;,1,1,2.4.18,2022-05-10 12:54:11,"
안녕하세요, JUN JUN님. 올리브영 온라인몰입니다.

먼저 저희 올리브영을 이용해주셔서 감사드리며, 이용에 불편을 끼쳐드려 대단히 죄송합니다.

문의주신 불편사항에 대해서는 2.4.18버전에서 일부 로그인 후 앱 꺼짐 현상이 발견되어 해당 부분 수정되었습니다. 최신 버전은 2.4.19버전으로 업데이트 부탁드리며, 추가 이슈 발생시, 온라인몰 고객센터(1522-0882, oliveweb@cj.net)로 자세한 현상 전달주시면 감사하겠습니다.

다시 한 번 이용에 불편을 드려 죄송합니다.
더 나은 서비스 제공을 위해 노력하겠습니다. 감사합니다.
",2022-05-10 14:52:23,2.4.18
a03a0dbf-17da-4edc-a947-d8c0b2ba546b,이은성,https://play-lh.googleusercontent.com/a/ACg8ocKCYNgsTPFqubkd1-LilvZY6DofNAkzegKFmizvvmNG=mo,로그인이 안돼요!!! 리뷰들 보니깐 전부 로그인이 안된다는건데 답변이라고는 제가 다시 문의하라는 답변뿐!! 문제가 있으면 앱개발쪽에서 해결해야지! 올리브영 삭제합니다~있어도 로그인이되어야 앱사용을하죠,1,22,2.2.4,2020-05-10 12:59:00,"올리브영 온라인몰 입니다. 
저희 올리브영을 찾아주셔서 감사드리며, 이용에 불편 드려 대단히 죄송합니다. 

로그인 불편사항은 담당 부서에 전달하여 개선 조치하고 있습니다. 고객님의 개인 정보보호를 위하여 앱스토어 상에서 자세한 사항을 여쭤보기 어려운 점 양해 부탁드립니다. 구체적인 증상 확인을 위해 온라인몰 고객센터(1522-0882, oliveweb@cj.net)로 연락 주시면 자세히 안내해 드리겠습니다. 

더 나은 서비스 제공을 위해 노력하겠습니다. 
감사합니다.",2020-05-11 13:22:27,2.2.4
1119947e-218a-49c9-9cd1-d2b0510c68fb,펭수,https://play-lh.googleusercontent.com/a-/ALV-UjXJOmu5n9HP5DhS5qxYnbhV1xU63oz6X-I7YB3xw7F5p-g,접속지연과 끊임없이 접속오류 스트레스..하.. 올리브영으로 주문할라고 해도 렉..렉...렉.. 노트9인데 너무 다른 앱에 비해 심하네요..ㅜㅜ,1,3,2.3.1,2021-01-16 09:18:41,"안녕하세요, 올리브영 온라인몰입니다. 속도 지연으로 앱 이용에 불편을 드려 죄송합니다. 디바이스 종류 및 OS 환경에 따라 속도 지연 이슈가 발생할 수 있으며, 앱 이용자가 한꺼번에 몰렸을 시에도 속도 지연이 발생할 수 있습니다. 보다 쾌적한 환경에서 쇼핑하실 수 있도록, 서비스를 지속해서 개선해나가도록 노력하겠습니다. 감사합니다.",2021-01-19 10:10:13,2.3.1
9e2f407c-a015-4deb-a1fa-d4db29a43eb5,안연주,https://play-lh.googleusercontent.com/a/ACg8ocLR6Lj0e6oaiKJw0yWuGta9ISz1hoOt_ZZgOZYv_-_4=mo,오늘 어플 접속하려고 보니 어플이 이상하게 굴러가요. 고객센터 문의하고싶은데 오류난 페이지다보니 고객센터 버튼도 못 찾겠고.. 온라인 홈페이지 들어가고싶어도 억지로 어플로 연결되요.,1,0,2.4.20,2022-05-25 10:52:02,"안녕하세요, 안연주님. 올리브영 온라인몰입니다. 먼저 저희 올리브영을 이용해주셔서 감사드리며, 이용에 불편을 끼쳐드려 대단히 죄송합니다. 오늘 오전, 일부 서버에 잠시 장애가 발생하였으나, 모두 복구 완료되었습니다. 현재는 별도의 앱 업데이트 없이 정상적인 이용이 가능합니다. 추가 이슈 발생시, 온라인몰 고객센터(1522-0882, oliveweb@cj.net)로 자세한 현상 전달주시면 감사하겠습니다. 다시 한 번 이용에 불편을 드려 죄송합니다. 더 나은 서비스 제공을 위해 노력하겠습니다. 감사합니다.",2022-05-25 15:44:56,2.4.20
f01b60d8-d85f-448b-abbe-f29766d260a8,Google 사용자,https://play-lh.googleusercontent.com/EGemoI2NTXmTsBVtJqk8jxF9rh8ApRWfsIMQSt2uE4OcpQqbFu7f7NbTK05lx80nuSijCz7sc3a277R67g,이앱쓰다가 암걸리겠어요. 결제에서 앱카드만 들어가면 계속 메인화면으로 넘어가서 몇번을 시도하다 가진 카드란 카드는 다해서 겨우성공하고 매장서 구매했더니 스마트영수증 발급했다더만 앱에서 구매조회도안되고.. 하 뭐이런 밤고구마같은...,1,115,2.1.3,2019-04-27 23:20:32,"반갑습니다, SUYANG LEE님. 올리브영 온라인몰입니다. 우선 저희 올리브영을 이용해주셔서 감사드리오며, 이용에 불편끼쳐드려 대단히 죄송합니다. 말씀주신 구매 내역 조회와 관련하여 현상 확인이 되지 않고 있습니다. 보다 정확한 원인 확인을 위해 번거로우시겠지만, 온라인몰 고객센터 (!588-0882 / 평일 9 ~18시)로 연락 부탁 드리겠습니다. 다시 한 번 불편끼쳐드려 대단히 죄송합니다. 오늘 하루도 좋은 하루 보내세요. 감사합니다.",2019-05-07 09:01:41,2.1.3
47c4beb0-a1f6-4ff3-8b25-43b5423da92e,uk jeon,https://play-lh.googleusercontent.com/a-/ALV-UjV0gTVaGmVvfIHRmPqOgteA_7fAFmbUcxsAH8_DZuOukw,로그인해서 쿠폰 다운로드하려고 클릭하면 계속 마이페이지로만 이동합니다.. App에서만 다운받을수 있는 쿠폰인데 어쩌라는건지요.. 갤s20울트라입니다,1,11,2.3.3,2021-02-03 20:55:27,"올리브영 온라인몰입니다. 로그인에 불편을 드려 대단히 죄송합니다. 구체적인 오류 현상 확인을 위해 온라인몰 고객센터(1522-0882, oliveweb@cj.net)로 아래 정보를 말씀주시면 상세히 안내 드리겠습니다. ① 디바이스 모델명(ex. Galaxy S20) ② 디바이스 설정→소프트웨어 정보→안드로이드 OS 버전(ex.10) ③ 오류 발생 페이지 및 오류 현상 ④ 올리브영 앱 좌측 하단 ≡ 버튼→우측 상단의 설정→앱 버전 정보 더 나은 서비스 제공을 위해 노력하겠습니다. 감사합니다.",2021-02-08 18:45:59,2.3.3
34e3e67c-9a29-4615-bcea-7a320807d44f,Google 사용자,https://play-lh.googleusercontent.com/EGemoI2NTXmTsBVtJqk8jxF9rh8ApRWfsIMQSt2uE4OcpQqbFu7f7NbTK05lx80nuSijCz7sc3a277R67g,결제창으로 왜 안 넘어가나요?? 결제하기 누르면 사용할 어플리케이션 선택하라고 이상한것만 뜹니다. 답답하네요.,2,11,2.0.6,2018-09-15 18:16:23,"반갑습니다, 이정연님. 올리브영 온라인몰입니다. 우선 저희 올리브영을 이용해주셔서 대단히 감사합니다. 문의주신 결제와 관련하여 불편을 끼쳐드려 대단히 죄송합니다. 말씀주신 결제 오류와 관련하여 구체적인 정보를 확인할 수 없어 안내가 어려운 부분 양해 부탁드립니다. 번거로우시겠지만 사용하시려는 카드 정보와 관련하여 저희 올리브영 고객센터(1522-0882/ 운영시간: 평일 오전 9시 ~ 오후 6시)로 연락 부탁드리겠습니다. 감사합니다.",2018-09-18 09:18:46,2.0.6
77ee1173-e4b5-46ab-90b4-53ea7d80faa5,Google 사용자,https://play-lh.googleusercontent.com/EGemoI2NTXmTsBVtJqk8jxF9rh8ApRWfsIMQSt2uE4OcpQqbFu7f7NbTK05lx80nuSijCz7sc3a277R67g,아쉬운 점이라면 자신이 원하는 매장에 사고싶은 물건이있는지 검색할 스 있는 기능이 있었으먼 좋겠어요,4,85,2.1.6,2019-09-23 00:35:45,,,2.1.6
762d7d26-6fcf-47dd-99cd-214ee56520e7,SUPHA슾하,https://play-lh.googleusercontent.com/a-/ALV-UjVasq9gro1DPkj2nMuDta6qMUaSDs-2hPfSLxYct9MGVP4,장바구니 추가하는데 15분 결제하는데 35분 걸림ㅋ 대기도 없이 흰 화면이 대부분... 서버라도 증설하던가 앱 속도 개선이라도 해주세요,1,2,2.4.16,2022-04-25 09:58:58,,,2.4.16
5f1576b7-a2da-4640-9fb6-88254550376e,혜빈,https://play-lh.googleusercontent.com/a-/ALV-UjWolBdt_fB_6UbeSjhnRAvTlDlB5RcxeS4CCPsO5zp6wg,진짜 앱이 너무 느림ㅋㅋ 또 멤버쉽 뜰때마다 자동으로 화면 밝아지는건 왜 이러는지 모르겠음 이런 권한을 설정한적이없는데 계속 눈뽕 ^_^,1,3,2.4.10,2022-02-03 11:00:10,,,2.4.10
d63bbf19-a283-4124-b9ae-027d3447ae58,서미경,https://play-lh.googleusercontent.com/a/ACg8ocIEUUjtgrvIzAdgcV99T1Ve3boQQ1wip706WV2MG7u9=mo,앱이느리고 터치눌러도 잘안되요 대기업앱인데 실망!!!!!!! 오늘드림배송은좋지만 앱은 개선바랍니다,2,1,3.0.3,2022-09-01 11:28:41,,,3.0.3
c076904d-4d12-4260-8547-92dba8824997,Google 사용자,https://play-lh.googleusercontent.com/EGemoI2NTXmTsBVtJqk8jxF9rh8ApRWfsIMQSt2uE4OcpQqbFu7f7NbTK05lx80nuSijCz7sc3a277R67g,주문시킨 상품 문제로 1:1문의를 드렸는데 이미 배송 준비중인 과정에서 답변이 됨. 답변 처리 되는 게 많이 느려서 도움이 하나도 안됨;; 이럴거면 문의가 왜 있는지 모르겠네요,2,6,2.1.4,2019-06-17 19:12:42,"반갑습니다, 킴치님. 올리브영 온라인몰입니다. 우선 저희 올리브영을 찾아주셔서 감사드리오며, 이용에 불편끼쳐드려 대단히 죄송합니다. 지난 올영세일 기간 동안 많은 고객님들이 저희 올리브영을 찾아주셔서 서비스 지연이 발생하였습니다. 고객님께 불편끼쳐드린 점 다시 한 번 사과의 말씀 드리며, 서비스 이용과 관련하여 추가 문의가 있으신 경우 저희 온라인몰 고객센터 (1522-0882 / 평일 오전 9 ~ 오후 6)로 연락주시면, 보다 신속하게 도와드리도록 하겠습니다. 감사합니다.",2019-06-24 08:52:14,2.1.4
c408935d-7ef9-42d5-925d-be09713f940f,나는냐돌멩이 (나는냐 돌멩이),https://play-lh.googleusercontent.com/a-/ALV-UjVcGeOj-i0KwEsmexqcEYpsp4wIOqY1cTVDf5UzbRrPgg,"앱 자체도 버벅거리고 느리고, 렉걸림 최악 중의 최악. 화병나서 뒤지라는 의미를 내포한듯한 속도임",1,1,3.1.6,2023-03-02 22:47:59,,,3.1.6
c7a02dbd-e9b1-4789-afbd-de7fd34eb2c9,Google 사용자,https://play-lh.googleusercontent.com/EGemoI2NTXmTsBVtJqk8jxF9rh8ApRWfsIMQSt2uE4OcpQqbFu7f7NbTK05lx80nuSijCz7sc3a277R67g,"제발 사이트 접속했을 때 서버가 안터지게 만드세요;; 이용자 수가 많아도 서버가 버틸 수 있게 만들어주세요,, 사려고 들어가도 살 수가 없어요,,",2,5,2.2.0,2019-12-08 23:11:08,,,2.2.0
f0b64691-350a-450a-a58c-6e097abc27ba,racoon L,https://play-lh.googleusercontent.com/a/ACg8ocIk15H3SWF8omR92135__uZSpuDxrggDhHTzSTYStPJ=mo,"매장픽업 주문하려는데(재고도 있다 나옴), 계속 오늘드림 배송지 선택이 안 됐다고 주문이 안 되네요.",1,2,2.4.20,2022-06-10 12:30:42,,,2.4.20
8fb98d91-4bef-4bbc-9944-7ba1ef59b87c,Google 사용자,https://play-lh.googleusercontent.com/EGemoI2NTXmTsBVtJqk8jxF9rh8ApRWfsIMQSt2uE4OcpQqbFu7f7NbTK05lx80nuSijCz7sc3a277R67g,잘만 연결되다가 선착순 쿠폰 받을때만 인터넷이 연결안됬다며 접속안됨 1분전까지도 접속하고 있었는데 다른 앱은 다 되는데..치사해서 쿠폰 안받음요!!,1,7,2.1.4,2019-05-30 10:09:16,"반갑습니다, Meesun Jung님. 올리브영 온라인몰입니다. 우선 저희 올리브영을 이용해주셔서 감사드리오며, 이용에 불편을 끼쳐드려 대단히 죄송합니다. 지난 30일 오전 10시, 올리브영에 대한 고객님들의 많은 관심과 성원으로 인해 일시적인 지연현상이 발생하였으나, 현재 정상 이용이 가능하십니다. 선착순 쿠폰을 이벤트 기간 오전과 오후 10시에 발급되고 있사오니, 다시 한 번 발급 부탁 드리겠습니다. 지속적으로 문제가 발생할 경우 온라인몰 고객센터 (1522-0882 / 평일 오전 9 ~ 오후 6)로 연락주시면 신속히 도와드리도록 하겠습니다. 다시 한번 불편끼쳐드려 대단히 죄송합니다. 감사합니다.",2019-06-03 09:34:34,2.1.4
54cccf5c-d453-478b-af89-1243cd25174c,김종열,https://play-lh.googleusercontent.com/a/ACg8ocLlAABJ1r09IDNLgbGH4cR2ih_U91x-knY2H5FU2YLl=mo,너무 렉이 많이 걸려서 나갔다 들어갔다 많이 해야하고 버퍼링도 많이 걸리는것같아요 ㅠㅠ그래도 쿠폰 후하게 주고 좋아요,3,1,2.4.9,2022-01-15 19:50:39,,,2.4.9
fa117a09-170c-4d36-bf2e-eeffcb5f6561,김희수,https://play-lh.googleusercontent.com/a/ACg8ocIwdT3LwSCzosCAT4ZOTs_E6z8sNH45Rw9Hxo8T1J89=mo,어플을 구매자가 쉽게 구매할 수 있게 만들어야지 구매하는 사람들 생각은 전혀 안하고 지내들 행사 광고만 늘어놓고 지들이 편하게만 만들어 놨으니 속도만 느리지 ......,1,3,,2021-12-02 12:28:23,,,
6ffce83b-530b-497b-aac9-9f577b32af7c,윤명빈,https://play-lh.googleusercontent.com/a-/ALV-UjVXZudUuZzCsfdBzJip7SKo71boFw55lmscwjoR_AYDJZc,제발 어플에 돈좀 들이세요 제발... 특히 딴앱보고오면 스마트폰의 인터넷연결이 끊어졌습니다 떠서 무조건 앱 다시시작해야함. 이런 어플 살면서 처음봄.,1,2,2.4.19,2022-06-02 08:36:36,,,2.4.19
5ac60457-f812-49c1-907e-26e80d64a7d6,Google 사용자,https://play-lh.googleusercontent.com/EGemoI2NTXmTsBVtJqk8jxF9rh8ApRWfsIMQSt2uE4OcpQqbFu7f7NbTK05lx80nuSijCz7sc3a277R67g,어플 로그인이 안 되네요. 어제부터 로그인하려고 하면 안 되고 화면이 제대로 뜨질 않아요.,1,9,2.2.1,2020-02-04 14:52:13,"올리브영 온라인몰입니다.
저희 올리브영을 찾아주셔서 감사드리며, 이용에 불편 드려 대단히 죄송합니다.

고객님의 개인 정보보호를 위하여 앱스토어 상에서 자세한 사항을 여쭤보기 어려운 점 양해 부탁드립니다.
온라인몰 고객센터(1522-0882, oliveweb@cj.net)로 아래 정보를 알려 주시면 확인 후 다시 안내해 드리겠습니다.

① 디바이스 모델명(ex. Galaxy S 20)
② 디바이스 설정→소프트웨어 정보→안드로이드 OS 버전(ex.8.0.1)
③ 오류 발생 페이지 및 오류 현상
④ 올리브영 앱 좌측 하단 ≡ 버튼→우측 상단의 설정→앱 버전 정보

더 나은 서비스 제공을 위해 노력하겠습니다.
감사합니다.",2020-05-06 19:34:16,2.2.1
e75f7521-26f1-4d28-aed7-547b4652510e,Google 사용자,https://play-lh.googleusercontent.com/EGemoI2NTXmTsBVtJqk8jxF9rh8ApRWfsIMQSt2uE4OcpQqbFu7f7NbTK05lx80nuSijCz7sc3a277R67g,개발팀 존1나1게1 무능력. 제일 기본중에 기본인 로그인 시스템을 한달 이상 못 잡아내고 있네,1,5,2.2.3,2020-03-31 01:08:57,"올리브영 온라인몰입니다.
저희 올리브영을 찾아주셔서 감사드리며, 이용에 불편 드려 대단히 죄송합니다.

고객님의 개인 정보보호를 위하여 앱스토어 상에서 자세한 사항을 여쭤보기 어려운 점 양해 부탁드립니다.
온라인몰 고객센터(1522-0882, oliveweb@cj.net)로 아래 정보를 알려 주시면 확인 후 다시 안내해 드리겠습니다.

① 디바이스 모델명(ex. Galaxy S 20)
② 디바이스 설정→소프트웨어 정보→안드로이드 OS 버전(ex.8.0.1)
③ 오류 발생 페이지 및 오류 현상
④ 올리브영 앱 좌측 하단 ≡ 버튼→우측 상단의 설정→앱 버전 정보

더 나은 서비스 제공을 위해 노력하겠습니다.
감사합니다.",2020-05-06 19:34:55,2.2.3
568a7fc0-c2b5-45b5-bcc2-dc0facbc5c10,김원,https://play-lh.googleusercontent.com/a/ACg8ocKgvJOr4A9VpQ2hyFhG4Mzv-sSdOo2Rt5j6ZdxQzvEF=mo,렉이너무심해요 상품화면-리뷰 터치하지않아도 버벅거리면서 탭 넘어가요 상품평 사진첨부시 카메라 실행시키면 강제종료돼요 툭하면 CJ멤버십바코드 화면으로 넘어가요 잔오류들이 진짜 너무많아요 좀 수정해주세요,3,66,2.4.1,2021-07-01 22:08:35,,,2.4.1
520f59ac-79ca-4598-9f31-3e1dfcb8be68,백승엽,https://play-lh.googleusercontent.com/a/ACg8ocKgoNleoCB6kDIv3-98XgJfEOOHxYnY5l_ClE5iOVjm=mo,최적화를 어떻게 한건지 뭔 어플이 이렇게 버벅거리고 로딩이 긴가요 이런 어플 만드는 개발자도 월급을 받아가네요 돈내고 일해야할듯ㅎ,1,2,2.4.7,2021-12-09 21:48:28,,,2.4.7
ae75aa6d-e8ba-4e1c-a7ad-f28b4defe8b1,우니,https://play-lh.googleusercontent.com/a-/ALV-UjUxB4e6MngRfu7XKMhFHU66ycASC-n4VC1Hl9ObkM_uoQ,앱속도 가면 갈수록 🐕느려져요 진심 내폰이 문제인가 했는데 리뷰보니 다른분들도 다 똑같네요 문제해결이 시급합니다,1,2,,2022-03-18 08:54:31,,,
233d93ae-385f-4412-bb2c-380ced0c86d1,Google 사용자,https://play-lh.googleusercontent.com/EGemoI2NTXmTsBVtJqk8jxF9rh8ApRWfsIMQSt2uE4OcpQqbFu7f7NbTK05lx80nuSijCz7sc3a277R67g,"진짜 돌아버리겠네요, 결제하려고 하면 왜 메인화면으로 돌아가나요...? 10번은 넘게 한 것 같은데..다른분들도 저와 같으신 분들이 꽤 계시는 것 같은데 앱 좀 고치실 생각이 없으신가요..?ㅠ 이럴거면 왜 앱특가네 첫구매고객 쿠폰이네 이런게 왜 있는거조...??",1,2,,2019-07-02 00:22:05,"반갑습니다, 김유라님. 올리브영 온라인몰입니다. 우선 저희 올리브영을 찾아주셔서 감사드리오며, 이용에 불편끼쳐드려 대단히 죄송합니다. 고객님께서 말씀주신 오류 현상은 저희 온라인몰 고객센터 (1522-0882 / 평일 오전 9 ~ 오후 6)로 연락주시면, 보다 신속하게 도와드리도록 하겠습니다. 감사합니다.",2019-07-03 09:14:41,
465b3ef3-cc37-42a0-9b9e-6ecc0758534f,Google 사용자,https://play-lh.googleusercontent.com/EGemoI2NTXmTsBVtJqk8jxF9rh8ApRWfsIMQSt2uE4OcpQqbFu7f7NbTK05lx80nuSijCz7sc3a277R67g,아이디 비밀번호 찾고 로그인 열심히 해도 안되네요 입력 방지 문자 음성까지 들어가면서 로그인 했는데도 안됩니다 확인 부탁드려요,1,2,2.1.0,2019-02-07 19:19:59,"반갑습니다, 황혜빈님. 올리브영 온라인몰입니다. 우선 저희 올리브영을 이용해주셔서 감사드리오며, 불편을 끼쳐드려 대단히 죄송합니다. 고객님께서 문의주신 로그인 부분과 관련한 현상이 현재 확인되지 않고 있습니다. 정확한 확인을 위해 고객님께서 겪으셨던 현상에 대한 정보가 필요합니다. 번거러우시겠지만 저희 올리브영 고객센터 (1522-0882: 평일 오전 9 ~ 18)로 연락주시면, 확인 후 도와드리도록 하겠습니다. 다시 한 번 불편 끼쳐드려 대단히 죄송합니다. 추운 날씨에 건강 유의하시고, 좋은 하루 보내세요. 감사합니다.",2019-02-08 08:43:20,2.1.0
a28c195a-5c7e-447c-bd1c-ed85d3e036f6,정연우,https://play-lh.googleusercontent.com/a-/ALV-UjXUJSIKBUtWwdc0KJlSrgitrvLNkRkh-678TXcPkgvTcAw,어플로 구매하고 택배로 받는데 일처리 진짜 느림. 어플에 딱히 기능이 있지도 않으니 앞으론 그냥 매장가서 구매할듯,1,1,2.4.7,2021-12-21 10:26:46,,,2.4.7
a4f9004c-27b0-4070-9c14-bf56cd092685,김가을,https://play-lh.googleusercontent.com/a/ACg8ocLZPMRO2que6chMOPhz4dmQo4VEGgNlJtK4XDvEax8=mo,배송 준비 시간이 1주일이 되는데 그래도 다음 주면 오겠지 하고 기다렸는데 배송지연을 배송 예정일에 알려주는건 좀... 아니 그럼 환불이라도 할 수 있게 해던가 배송 준비중에 환불을 못하게 하면 다른데서 사지도 못하잖아요...,1,1,3.1.2,2022-12-27 08:15:33,,,3.1.2
b9a98568-a400-43a9-a3ba-d74ce002ab65,Y.J,https://play-lh.googleusercontent.com/a/ACg8ocLJ8Pu4wrlFdNNCl9rhBsk-WAq4Qr9HjY9hPIiAgGuO=mo,앱이 느려도 너무 느려서 짜증나네요. 제가 이것보단 관리 잘하겠어요. 운영자는 뭘 하고는 있는건지.,1,0,,2021-12-09 00:04:05,,,
346fc4c1-4212-406e-9e13-bc5a3fd87b62,정다영,https://play-lh.googleusercontent.com/a/ACg8ocKfyl67-7NIZ5t1wtwTLrwAYlrvhN1hnsOtRvQ0OzekzQ=mo,와 진짜 느려요 하.. 1년동안 썼는데 정말 답답하네요. 광고는 또 너무 많아서 쇼핑할 때 불편하고요. 제발 속도 개선 좀 해주세요,1,3,2.4.10,2022-02-06 23:09:33,,,2.4.10
403dc258-3c6f-4efc-a5c6-a7c2fae6c43a,YeYoung Hwang,https://play-lh.googleusercontent.com/a/ACg8ocKu0RvEJk2oqh4fVTPGQJn4NlNM3MvLUB2rzNLEhARDoA=mo,"예전에 가입했다가 최근에 올리브영에서 결제할 일 생겨서 다시 깔았는데, 오류가 심한 것 같아요. 왜 마이페이지에는 제 이름부터 포인트까지 다 보여주면서 뭐만 하려고 하면 로그인을 해야한다고 하는건가요?? 이것 때문에 매장 내 계산대 앞에서 시간만 잡아먹고 뭐 하지는 못했네요. 매장 내 직원분들께만 죄송해지고.",1,24,2.4.5,2021-10-07 14:07:21,,,2.4.5
b376c878-70c1-4b4e-a55b-f38512f6f2d0,Google 사용자,https://play-lh.googleusercontent.com/EGemoI2NTXmTsBVtJqk8jxF9rh8ApRWfsIMQSt2uE4OcpQqbFu7f7NbTK05lx80nuSijCz7sc3a277R67g,전시기간이 아니라고 계속 뜹니다. 오늘부로 삭제 합니다.. 도저히 크롬으로 들어가는 것보다 낫지가 않네요.,1,13,2.1.1,2019-03-17 21:51:05,"반갑습니다, 김시내님. 올리브영 온라인몰입니다. 우선 저희 올리브영을 이용해주셔서 감사드리오며, 이용에 불편끼쳐드려 대단히 죄송합니다. 문의주신 전시시간 안내 현상은 유관부서에 전달하여 현상 확인 및 조치 취하도록 하겠습니다. 다시 한 번 불편 끼쳐드려 대단히 죄송하오며, 지속적으로 문제 현상을 겪으시는 경우 저희 온라인몰 고객센터 (1588-0882 / 평일 9~18시)로 연락주시면 신속히 도와드리도록 하겠습니다. 다시 한 번 불편끼쳐드려 대단히 죄송합니다. 오늘 하루도 좋은 하루 보내세요. 감사합니다.",2019-03-18 08:46:20,2.1.1
54b80a8c-7031-427a-9398-4e2ca6bffa2e,Google 사용자,https://play-lh.googleusercontent.com/EGemoI2NTXmTsBVtJqk8jxF9rh8ApRWfsIMQSt2uE4OcpQqbFu7f7NbTK05lx80nuSijCz7sc3a277R67g,다운받았는데 데이터 연결이 안된다고 계속 안들어가지네요 와이파이랑 데이터 다 해봤는데,1,1,2.0.8,2018-12-01 17:08:11,"반갑습니다, SCENCE FLORE님. 올리브영 온라인몰입니다. 우선 저희 올리브영을 이용해주셔서 대단히 감사드리오며, 이용에 불편을 끼친 점 사과 말씀드립니다. 지난 1일 저희 올리브영에 대한 고객님들의 많은 사랑과 관심 속 사용자 폭주로 인해 일시적인 지연 현상이 발생하였습니다. 현재는 서비스 정상 이용이 가능하오니, 앞으로 저희 온라인몰에 대한 지속적인 관심 부탁드리겠습니다. 세일이 3일 남았습니다.금번 세일 행사를 통해 좋은 상품 많이 이용하시고, 더욱 좋은 서비스와 혜택으로 보답하겠습니다. 추운 날씨에 건강 유의하시고 좋은 하루 보내세요. 감사합니다. :D",2018-12-03 09:04:58,2.0.8
ff397576-1668-4b4f-9ddf-6186f25d129c,Ji Shin,https://play-lh.googleusercontent.com/a-/ALV-UjUg5G0DquWZyaWuxEbc5HjX5EKpHXEL6eUf01uYeBnJZg,잘쓰고 있었는데 업데이트가 안됩니다. 삭제후 다시 설치해도 업데이트하라고 하고 어떻게해도 안들어가지네요.,3,3,2.4.4,2021-09-16 19:16:53,,,2.4.4
b06049e3-4f85-4771-9167-3036072729fe,전효진,https://play-lh.googleusercontent.com/a/ACg8ocIMoZKsG96CknnSJ-Sn-wHmu85rLQJ7uUwab4pw0Tgq=mo,평생 쓴 모든 어플중에 가장 느림. 10년전에 앵그리버드를 갤럭시 s1으로 돌렸을 때랑 속도 비슷해요. 한국인은 속터져서 이 어플 못써요. it's for foreigners🤮,1,2,2.4.14,2022-03-09 18:27:35,,,2.4.14
57c795e9-4ca8-475a-922a-8a208465de96,East Coast,https://play-lh.googleusercontent.com/a-/ALV-UjX-NYWHrHhUjqnoKxqjwceO9c4_s8gA-ER8IEPO6P674ak,"어플속도가 너무 느려요.. 검색하는데 한세월,, 제품창 로딩되는데 한세월,, 그것만 제발 개선해주십사..",2,4,2.4.15,2022-04-04 22:31:49,,,2.4.15
fc5ec7d0-dd0a-4adb-8260-020e160b2aaa,위한별,https://play-lh.googleusercontent.com/a-/ALV-UjWNQ7uOd7cRf9fEIwwUz18apmGjEwc465uvqm0NDqxGzBo,"폰 기종 (갤럭시 S10+) 다 좋은데 앱 자체가 렉이 많이 걸리고, 너무 느려서 답답해요 ㅜ 개선 부탁드려요",2,11,2.3.4,2021-03-05 01:57:01,"안녕하세요, 올리브영 온라인몰입니다. 속도 지연으로 앱 이용에 불편을 드려 죄송합니다. 디바이스 종류 및 OS 환경에 따라 속도 지연 이슈가 발생할 수 있으며, 앱 이용자가 한꺼번에 몰렸을 시에도 속도 지연이 발생할 수 있습니다. 보다 쾌적한 환경에서 쇼핑하실 수 있도록, 서비스를 지속해서 개선해나가도록 노력하겠습니다. 감사합니다.",2021-03-08 19:03:38,2.3.4
ddc02e5f-7b8d-40ad-bfd2-0e25ca850fd1,이진용,https://play-lh.googleusercontent.com/a/ACg8ocJ9jxribeaRcD9ELKUQp_9W6h57OO92r9BzeZK-3sBb=mo,뭔 이벤트 끝나기 40분전부터 계속 결제 눌러도 사용자 많다고 대기 계속해도 다시 원점으로 돌아와지고 ㅆ 시간 다 지나서 아무것도 못샀네,1,0,3.1.10,2023-06-08 00:04:11,,,3.1.10
3b4e382b-ff28-49c7-9dec-b69a9fd81a3a,사람,https://play-lh.googleusercontent.com/a-/ALV-UjWX4LD6BzaPIGYG0cjQl6BV51BVNFLhuLX5x77u7hrqcokk,터치가 아무것도 안되는데요 다른 앱 들어가면 다 작동하고 폰엔 아무 문제 없는데 이 앱은 실행하면 터치가 하나도 안되네요 고쳐주세요,1,1,3.1.4,2023-02-22 03:14:10,,,3.1.4
